ID,Type,SKU,Name,Published,Is featured?,Visibility in catalog,Short description,Description,Date sale price starts,Date sale price ends,Tax status,Tax class,In stock?,Stock,Backorders allowed?,Sold individually?,Weight (lbs),Length (in),Width (in),Height (in),Allow customer reviews?,Purchase note,Sale price,Regular price,Categories,Tags,Shipping class,Images,Download limit,Download expiry days,Parent,Grouped products,Upsells,Cross-sells,External URL,Button text,Position,Attribute 1 name,Attribute 1 value(s),Attribute 1 visible,Attribute 1 global,Attribute 2 name,Attribute 2 value(s),Attribute 2 visible,Attribute 2 global,Meta: _wpcom_is_markdown,Download 1 name,Download 1 URL,Download 2 name,Download 2 URL0,simple,brandy-jewelry-dark-product-2,Metal hair keeper,1,1,visible,"Lorem ipsum dolor sit amet, consectetur adipiscing elit, sed do eiusmod tempor incididunt ut labore et dolore magna aliqua. Ut enim ad minim veniam, quis nostrud exercitation ullamco laboris nisi ut aliquip ex ea commodo consequat.","Sed ut perspiciatis unde omnis iste natus error sit voluptatem accusantium doloremque laudantium, totam rem aperiam, eaque ipsa quae ab illo inventore veritatis et quasi architecto beatae vitae dicta sunt explicabo. Nemo enim ipsam voluptatem quia voluptas sit aspernatur aut odit aut fugit, sed quia consequuntur magni dolores eos qui ratione voluptatem sequi nesciunt. Neque porro quisquam est, qui dolorem ipsum quia dolor sit amet, consectetur, adipisci velit, sed quia non numquam eius modi tempora incidunt ut labore et dolore magnam aliquam quaerat voluptatem. Ut enim ad minima veniam, quis nostrum exercitationem ullam corporis suscipit laboriosam, nisi ut aliquid ex ea commodi consequatur? Quis autem vel eum iure reprehenderit qui in ea voluptate velit esse quam nihil molestiae consequatur, vel illum qui dolorem eum fugiat quo voluptas nulla pariatur?",,,taxable,,1,,0,0,,,,,1,,,341,Jewelry > Ear Keeper,,,http://img.wpbrandy.com/uploads/jewelry-dark-product-2.png,,,,,,,,,0,,,,,,,,,,,,,
0,simple,brandy-houseware-product-1,Black Clay Coffee Mug,1,1,visible,Sleek water pitcher with advanced filtration system and built-in filter replacement indicator.,"The AquaPure Filtered Water Pitcher features a state-of-the-art filtration system that removes impurities and chlorine from tap water, ensuring a clean and refreshing taste. With its sleek, ergonomic design and a capacity of 10 cups, it’s perfect for everyday use. The pitcher also includes a built-in indicator to let you know when it’s time to replace the filter.",,,taxable,,1,,0,0,,,,,1,,30.43,34.43,Mug,,,http://img.wpbrandy.com/uploads/houseware-product-1.png,,,,,,,,,0,,,,,,,,,,,,,,,,,,,,,,,,,,,,,,,,,,,,,,,,,,,,,,,,,,,,,,,,,,,,,,,
0,simple,brandy-houseware-product-2,Blue ceramic plant pot with saucer,1,1,visible,"Airtight, leak-proof food storage containers that keep food fresh and are microwave and dishwasher safe.","EverFresh Food Storage Containers come in a set of five with airtight, leak-proof lids that keep your food fresh longer. Made from BPA-free, durable plastic, these containers are microwave, dishwasher, and freezer safe. Their stackable design ensures easy storage and organization in your pantry or fridge.",,,taxable,,1,,0,0,,,,,1,,23.43,34.43,Pot,,,http://img.wpbrandy.com/uploads/houseware-product-2.png,,,,,,,,,0,,,,,,,,,,,,,,,,,,,,,,,,,,,,,,,,,,,,,,,,,,,,,,,,,,,,,,,,,,,,,,,
0,simple,brandy-houseware-product-3,"Jade flower vase, blue",1,1,visible,"Soft memory foam bath mat with a non-slip backing, offering comfort and quick drying.","The LuxeComfort Memory Foam Bath Mat provides plush cushioning and superior absorbency right out of the shower. Made with a high-density memory foam core and a non-slip backing, it offers both comfort and safety. The soft, machine-washable cover dries quickly and adds a touch of luxury to your bathroom.",,,taxable,,1,,0,0,,,,,1,,,34.43,Vase > Flower Vase,,,http://img.wpbrandy.com/uploads/houseware-product-3.png,,,,,,,,,0,,,,,,,,,,,,,,,,,,,,,,,,,,,,,,,,,,,,,,,,,,,,,,,,,,,,,,,,,,,,,,,
0,simple,brandy-houseware-product-4,Blue ceramic serving dish,1,1,visible,"Stainless steel coffee filter that’s reusable and eco-friendly, offering rich flavor and easy cleaning.","The EcoBrew Reusable Coffee Filter is designed to provide a sustainable and eco-friendly alternative to disposable paper filters. Made from stainless steel mesh, it fits most standard coffee makers and ensures a full-bodied, rich coffee flavor. Its easy-to-clean design makes it a convenient and environmentally-conscious choice.",,,taxable,,1,,0,0,,,,,1,,54.43,64.43,Dish,,,http://img.wpbrandy.com/uploads/houseware-product-4-3.png,,,,,,,,,0,,,,,,,,,,,,,,,,,,,,,,,,,,,,,,,,,,,,,,,,,,,,,,,,,,,,,,,,,,,,,,,
0,simple,brandy-houseware-product-5,Gray ceramic flower vase,1,1,visible,Compact induction cooktop with precise temperature control and rapid heating for efficient cooking.,"The ZenCook Induction Cooktop is a compact and efficient portable cooking solution with precise temperature control and rapid heating capabilities. Featuring a sleek touch-control panel and multiple cooking modes, it’s perfect for quick meals or as an extra burner in your kitchen. Its easy-to-clean surface and safety features make it a practical addition to any kitchen.",,,taxable,,1,,0,0,,,,,1,,,34.43,Vase > Flower Vase,,,http://img.wpbrandy.com/uploads/houseware-product-5.png,,,,,,,,,0,,,,,,,,,,,,,,,,,,,,,,,,,,,,,,,,,,,,,,,,,,,,,,,,,,,,,,,,,,,,,,,
0,simple,brandy-houseware-product-6,Rustic decorative plant pot,1,1,visible,Ultrasonic diffuser with adjustable mist settings and LED light for a calming aromatic experience.,"The SereneBreeze Ultrasonic Essential Oil Diffuser uses ultrasonic technology to disperse your favorite essential oils into a fine mist, creating a calming and aromatic atmosphere. With adjustable mist settings and a built-in LED light that can cycle through various colors, it’s perfect for enhancing relaxation in any room. The diffuser also features an automatic shut-off function for safety.",,,taxable,,1,,0,0,,,,,1,,,24.55,Pot,,,http://img.wpbrandy.com/uploads/houseware-product-6.png,,,,,,,,,0,,,,,,,,,,,,,,,,,,,,,,,,,,,,,,,,,,,,,,,,,,,,,,,,,,,,,,,,,,,,,,,
0,simple,brandy-houseware-product-7,Blue ceramic serving round dish,1,1,visible,Automated robot vacuum with advanced navigation and powerful suction for effortless cleaning.,"The MetroClean Robot Vacuum Cleaner offers convenient, automated cleaning with advanced navigation and powerful suction. Its slim design allows it to reach under furniture and its intelligent sensors help it avoid obstacles and stairs. With programmable cleaning schedules and a large dustbin, it’s designed to keep your floors spotless with minimal effort.",,,taxable,,1,,0,0,,,,,1,,,24.64,Dish,,,http://img.wpbrandy.com/uploads/houseware-product-7.png,,,,,,,,,0,,,,,,,,,,,,,,,,,,,,,,,,,,,,,,,,,,,,,,,,,,,,,,,,,,,,,,,,,,,,,,,